{
  "schema_version": "0.2",
  "id": "A-2026-001",
  "created_at": "2026-10-29T12:00:00Z",
  "producer": {
    "kind": "tool",
    "name": "x",
    "version": "1"
  },
  "mode": "create",
  "answers": {
    "Q1": {
      "value": "x",
      "source": "asked",
      "confirmed": true
    }
  },
  "consequences": []
}